,text,lang,place_lat,place_lon,place_type,country,in_reply_to_user_id_str,user_id_str,followers_count,verified,pronoun,created_at,location,description
17882,te acuerdas como perdí mi dignidad contigo y que ironía tu perdiendo la tuya con otro que no va a valer la pena así pasen los años,es,7.063666499,-73.0964135,city,Colombia,,613113533,183,FALSE,tu,Sun Sep 06 22:39:20 +0000 2015,"Bucaramanga, Colombia ","['vive', 'la', 'vida', 'lucha', 'por', 'tus', 'sueños', 'estudiante', 'de', 'ingeniería', 'ambiental', '#col']"
17923,hablar contigo y sentir esos nervios en el estomago,es,4.262283503,-74.243671,city,Colombia,,135705970,968,FALSE,tu,Sun Sep 06 23:02:44 +0000 2015,colombia,"['estudiante', 'de', 'contaduría', 'y', 'finanzas']"
17966,@jhojanhincapie amigui a ti no se te critica nada desde esta cuenta,es,3.364181997,-76.49608,city,Colombia,194318751,1491687714,790,FALSE,tu,Sun Sep 06 23:25:51 +0000 2015,Santiago de Cali,"['estudiante', 'y', 'resistente', 'hit', 'the', 'road', 'jack']"
17995,por ti haré lo que este en mis manos,es,4.262283503,-74.243671,city,Colombia,,135705970,968,FALSE,tu,Sun Sep 06 23:39:48 +0000 2015,colombia,"['estudiante', 'de', 'contaduría', 'y', 'finanzas']"
18004,dos años sin ti como te extraño tío #crga,es,4.262283503,-74.243671,city,Colombia,,576527496,67,FALSE,tu,Sun Sep 06 23:45:22 +0000 2015,BOGOTA,"['estudiante', 'de', 'la', 'universidad', 'la', 'gran', 'colombia', 'orgullosa', 'de', 'ser', 'llanera', 'instagram', 'andreagonzalez', '1015']"
18012,mi guapo mi guapito mi muchachito y yo contigo quiero hacerme un hijo,es,7.144792999,-73.132697,city,Colombia,,1385205661,412,FALSE,tu,Sun Sep 06 23:47:06 +0000 2015,Bucaramanga/Santander,"['estudiante', 'de', 'comunicación', 'social']"
18013,ni el tiempo ni la distancia hace desaparecer lo lindo que es pasar tiempo contigo gracias por tu amistad,es,4.312452,-74.4376075,city,Colombia,,2812586578,280,FALSE,tu,Sun Sep 06 23:47:11 +0000 2015,Bogota D.C,"['hija', 'de', 'dios', 'estudiante', 'de', 'contaduría', 'pública', 'instagram', '@loregmurcia', 'colombiana', 'mci', 'dios', 'mi', 'vida', 'entera', 'millonarios', '\\']"
18017,yo sigo aquí por ti millonarios,es,4.681281499,-73.925527,city,Colombia,,524761839,970,FALSE,tu,Sun Sep 06 23:49:57 +0000 2015,,"['destinados', 'a', 'estar', 'juntos', 'desde', 'el', 'dia', 'en', 'que', 'nacimos', '212057', 'estudiante', 'de', 'psicologia', 'madridista']"
18035,estos podríamos ser tú y yo pero la cagaste @americadecali,es,3.570428504,-76.3486225,city,Colombia,,221424013,1209,FALSE,tu,Mon Sep 07 00:03:57 +0000 2015,"Santiago De Cali, Colombia.","['estudiante', 'de', 'ing', 'electronica', 'en', 'la', 'usb', 'cali', 'deportivo', 'caliu', '2665doritosu2665cocacolau2665chocorramou2665']"
18076,todo mi amor siempre es para ti glorioso león,es,6.270882998,-75.619213,city,Colombia,,847694160,325,FALSE,tu,Mon Sep 07 00:20:18 +0000 2015,"Medellin, Colombia","['un', 'amor', 'para', 'toda', 'la', 'vida', 'll', '°', 'estudiante', 'de', 'estadistica', '#un']"
18173,muchas veces extraño hablar contigo,es,4.262283503,-74.243671,city,Colombia,,418104326,306,FALSE,tu,Mon Sep 07 19:38:49 +0000 2015,,"['estudiante', 'gestion', 'bancaria', 'y', 'de', 'entidades', 'financieras', 'instagram', 'mariiacamiila', '30']"
18177,soñar en grande pero contigo a mi lado,es,4.262283503,-74.243671,city,Colombia,,167259410,7534,FALSE,tu,Mon Sep 07 19:40:56 +0000 2015,Bogotá,"['i', 'u2665', 'new', 'york', 'estudiante', 'de', 'gastronomía', 'en', 'gato', 'dumas']"
18180,#noesmentirasitedigo que no dejo de pensar en ti,es,4.262283503,-74.243671,city,Colombia,,418104326,306,FALSE,tu,Mon Sep 07 19:44:38 +0000 2015,,"['estudiante', 'gestion', 'bancaria', 'y', 'de', 'entidades', 'financieras', 'instagram', 'mariiacamiila', '30']"
18196,buscando un rumbo fijoun objetivo preciso no busco un camino perdido ni un tren sin rumbo solo busco un camino verdadero contigo,es,4.262283503,-74.243671,city,Colombia,,989107470,205,FALSE,tu,Mon Sep 07 19:59:43 +0000 2015,"Cali, Valle del Cauca","['estudiante', 'de', 'ingeniería', 'electrónica', 'amante', 'de', 'la', 'música']"
18199,y hasta el orgullo muere cuando quiero llegar hacia ti,es,4.262283503,-74.243671,city,Colombia,,1175479663,225,FALSE,tu,Mon Sep 07 20:01:27 +0000 2015,,"['estudiante', 'psicología', 'u', 'el', 'bosque', 'bogotá', 'colombia']"
18213,sólo quise que se detuviera el tiempo cuando estaba contigo y que lo nuestro fuera único y lo más hermoso del mundo,es,4.044109503,-71.743993,city,Colombia,,111136789,113,FALSE,tu,Mon Sep 07 20:16:50 +0000 2015,Bogotá-Colombia,"['estudiante', 'de', 'ing', 'química', 'en', '@latadeo', 'amante', 'de', 'un', 'buen', 'café', 'y', 'de', 'la', 'poesía', 'en', 'la', 'vida', 'hay', 'cosas', 'difíciles', 'están', 'para', 'aceptarlas', 'y', 'hacernos', 'mas', 'fuertes']"
18266,completamente aferrada a ti y sin ti,es,2.988736497,-75.3222715,city,Colombia,,331402862,164,FALSE,tu,Mon Sep 07 20:50:30 +0000 2015,Neiva- Colombia,"['estudiante', 'de', 'ingeniería', 'de', 'la', 'universidad', 'surcolombiana', 'fanática', 'del', 'fútbol', 'de', 'la', 'buena', 'música', 'y', 'la', 'literatura', 'siempre', 'con', 'dios']"
18346,ya no espero nada de ti quisiera saber que pretendes conmigo,es,4.262283503,-74.243671,city,Colombia,,2693657050,6,FALSE,tu,Mon Sep 07 21:33:05 +0000 2015,,"['estudiante', 'de', 'comunicación', 'social', 'y', 'periodismo', 'amo', 'lo', 'que', 'hago', 'los', 'sueños', 'nunca', 'mueren']"
18373,no hay duda si has conocido a alguien diferente es porque tú ya no eres el mismo,es,11.6270322,-72.58668457,city,Colombia,,550535784,3052,FALSE,tu,Mon Sep 07 21:46:46 +0000 2015,            colombia,"['estudiante', 'de', 'contaduría', 'publica', 'universidad', 'de', 'la', 'guajira']"
18520,ni tú quieres,es,10.95807288,-74.849933,city,Colombia,,344843224,524,FALSE,tu,Mon Sep 07 22:54:33 +0000 2015,"Barranquilla, Atlántico","['estudiante', 'de', 'derecho']"
18542,yo pense que nunca me iria de ti que es amor del bueno de toda la vida pero hoy entendí que no hay suficiente para los dos,es,10.95807288,-74.849933,city,Colombia,,445063346,91,FALSE,tu,Mon Sep 07 23:07:29 +0000 2015,Barranquilla,"['estudiante', 'de', 'arquitectura']"
18555,sabes que alguien te quiere cuando no conoce límites para poder estar junto a ti,es,11.2312007,-72.994963,city,Colombia,,550535784,3052,FALSE,tu,Mon Sep 07 23:21:33 +0000 2015,            colombia,"['estudiante', 'de', 'contaduría', 'publica', 'universidad', 'de', 'la', 'guajira']"
18564,tú solito te arruinas el día depende de ti de nadie más sonríe y sé feliz,es,11.2312007,-72.994963,city,Colombia,,550535784,3052,FALSE,tu,Mon Sep 07 23:24:34 +0000 2015,            colombia,"['estudiante', 'de', 'contaduría', 'publica', 'universidad', 'de', 'la', 'guajira']"
18592,después de ti quien,es,3.364181997,-76.49608,city,Colombia,,528801163,247,FALSE,tu,Mon Sep 07 23:33:47 +0000 2015,colombia - tunja,"['amor', 'mi', 'vida', 'siempre', 'junto', 'a', 'ti', 'adag', 'estudiante', 'de', 'arquitectura', 'universidad', 'santo', 'tomás']"
18600,@donotforgetme solo lo comparto contigo,es,4.567087498,-75.6021415,city,Colombia,2910322671,143983179,506,FALSE,tu,Mon Sep 07 23:37:56 +0000 2015,Armenia-Quindío,"['estudiante', 'de', 'derecho', 'universidad', 'la', 'gran', 'colombia']"
18678,@jessika1093 tú yo milly a nuestros pies no sé piénsalo pd ah thinner i,es,4.762178502,-75.72812,city,Colombia,1074695730,73793241,41,FALSE,tu,Tue Sep 08 00:07:02 +0000 2015,Colombia,"['estudiante', 'de', 'derecho']"
18685,y me enamorare de ti aunque sufra por que no hay rosas sin espinasss,es,10.95807288,-74.849933,city,Colombia,,202425237,275,FALSE,tu,Tue Sep 08 00:08:48 +0000 2015,Fonseca  - Barranquilla,"['estudiante', 'de', 'odontología', 'creyente', 'de', 'dios', 'y', 'amante', 'del', 'vallenato']"
18723,los aldeanos solo tú,es,4.262283503,-74.243671,city,Colombia,,369211940,2121,FALSE,tu,Tue Sep 08 00:20:05 +0000 2015,Colombia,"['diseñador', 'gráfico', 'estudiante', 'de', 'mercadeo', 'publicidad', 'amante', 'de', 'el', 'fútbol', 'hincha', 'de', 'millonarios', 'fc', 'one', 'love', '#cfc', 'u26bdufe0f']"
18741,ese momento incómodo cuando esa persona se queda mirándote a los ojos tú no sabes si hablarle irte o empezar a bailar joropo,es,10.3244505,-73.463286,city,Colombia,,96051356,931,FALSE,tu,Tue Sep 08 00:26:30 +0000 2015,,"['hija', 'de', 'dios', 'enamorada', 'de', 'su', 'u2665', 'día', 'a', 'día', 'apasionada', 'por', 'la', 'música', 'del', 'cielo', 'u2665u2665', 'estudiante', 'de', 'psicología', 'deuteronomio', '318']"
18761,@zeroengel a propósito si no m equivoco saludes a mi exsuegrita o sea a tú hermosa mamá q feliz cumpleaños d una lejana admiradora tuya,es,4.262283503,-74.243671,city,Colombia,1177031478,117194212,469,FALSE,tu,Tue Sep 08 00:33:31 +0000 2015,"Bogotá, Distrito Cardenal.","['a', 'luchar', 'contra', 'la', 'tiranía', 'del', 'principio', 'del', 'placer', 'a', 'complementarlo', 'con', 'la', 'realidad', 'y', 'a', 'ejercer', 'la', 'difícil', 'tarea', 'de', 'gobernarse', 'estudiante', 'de', 'psicología']"
18781,y tú ni lo sabes,es,6.139383498,-75.590644,city,Colombia,,128667007,143,FALSE,tu,Tue Sep 08 00:38:47 +0000 2015,"MEDELLÍN, COLOMBIA ","['estudiante', 'de', 'comunicación', 'social', 'family', 'its', 'all', 'u2764u2764']"
18804,te estaba buacando por las calles gritando como un loco tomando es que tu sinmi yo sin ti eato no me gusta,es,4.262283503,-74.243671,city,Colombia,,201260948,988,FALSE,tu,Tue Sep 08 00:47:37 +0000 2015,Bogotá,"['u2764', 'estudiante', 'de', 'medicina', 'que', 'le', 'gustan', 'los', 'pandas', 'y', 'habla', 'de', 'solo', 'chinos', 'gordo', 'teton', '@gaemgyu', 'u2764', 'eunhae', 'shipper', 'u2764', 'infinite', 'multifandumdumbo']"
18822,@alexreldex oye tú,es,4.812912999,-75.737506,city,Colombia,2167868275,436351448,23,FALSE,tu,Tue Sep 08 00:54:03 +0000 2015,"Risaralda, Colombia","['estudiante', 'de', 'arquitectura', 'ucp', 'instangram', '@tefanymedina']"
18857,contigo todou 2764,es,4.262283503,-74.243671,city,Colombia,,157697937,357,FALSE,tu,Tue Sep 08 01:02:36 +0000 2015,,"['estudiante', 'de', 'educación', 'infantil', 'universidad', 'pedagógica', 'nacional']"
18905,@kevinyate y a ti también por q tu eras el de los cumple no samuu 2661bebé amp yo pero aun así recibimos jejeje te amamos moooor,es,4.333480001,-74.8389735,city,Colombia,299795726,1486338836,287,FALSE,tu,Tue Sep 08 19:32:24 +0000 2015,Samu<U+2661> TeamoHijo! K3,"['estudiante', 'de', 'leyes', 'facultad', 'de', 'derecho']"
18910,soy yo en versión túu 2665,es,4.262283503,-74.243671,city,Colombia,,586327998,127,FALSE,tu,Tue Sep 08 19:36:04 +0000 2015,Colombia,"['amando', 'a', 'medellín', 'y', 'dándole', 'las', 'gracias', 'a', 'bogotá', 'estudiante', 'de', 'comunicación', 'social', 'u2661princesa', 'de', 'dios', 'y', 'de', 'la', 'virgenu', '2661']"
18962,@dani3palaciosdj @umusiccolombia bien por ti tienes talento de sobra y vas a seguir cosechando exitos como dj y en el cartel,es,4.0882915,-73.4704055,city,Colombia,123731499,1976699394,1085,FALSE,tu,Tue Sep 08 20:18:39 +0000 2015,Villavicencio-meta,"['estudiante', 'd', 'regencia', 'd', 'farmacia', 'en', 'la', 'unillanos', 'amante', 'd', 'la', 'musik', 'rock', 'del', 'futbol', 'y', 'del', 'mundo', 'paranormal', 'gracias', 'al', 'cartel', 'd', 'la', 'meganovia', 'de', 'javier', 'sandoval']"
18982,me gusta como te rindes a mi entregándote sin condiciones sin pedirme nada para ti,es,4.262283503,-74.243671,city,Colombia,,470499434,245,FALSE,tu,Tue Sep 08 20:37:08 +0000 2015,Colombia <U+2665>,"['u2728', 'estudiante', 'de', 'contaduría', 'publica', 'universidad', 'de', 'la', 'salle', 'u2728', 'analista', 'contable', 'en', '@solcol']"
18996,aunque muy poco te conozca definitivamente veo en ti lo que hace tanto pero tanto tiempo me faltaba a mí aunque no sé si yo te guste,es,11.07346239,-73.92732164,city,Colombia,,372026889,399,FALSE,tu,Tue Sep 08 20:47:48 +0000 2015,Santa Marta,"['dios', 'es', 'mi', 'pazu', '2665', 'estudiante', 'de', 'comunicación', 'social', 'y', 'periodismo', 'en', 'formación']"
19008,tratar de estudiar u2712 contigo es algo un poco difícil no se si perderme en tus risas o estudiar la sentencia te amo consentido,es,4.333480001,-74.8389735,city,Colombia,,1486338836,287,FALSE,tu,Tue Sep 08 21:00:00 +0000 2015,Samu<U+2661> TeamoHijo! K3,"['estudiante', 'de', 'leyes', 'facultad', 'de', 'derecho']"
19009,cuida muy bien tu reputación porque vivirá más años que tú,es,10.3244505,-73.463286,city,Colombia,,197164327,1241,FALSE,tu,Tue Sep 08 21:00:26 +0000 2015,Valledupar,"['estudiante', 'de', 'psicología', 'analítico', 'y', 'lector', 'prensa', 'de', '@origenvalledupa']"
19056,no hay nada más extraño que una señora en la calle se quite el sostén frente a ti,es,4.439162497,-74.2829035,city,Colombia,,127373106,1050,FALSE,tu,Tue Sep 08 22:34:49 +0000 2015,Colombia-Bogota,"['estudiante', 'de', 'ingeniería', 'industrial', 'universidad', 'de', 'cundinamarca', 'me', 'encanta', 'el', 'rock', 'el', 'punk', 'y', 'el', 'metal', 'mi', 'agrupación', 'favorita', '#blink182']"
19067,cuando las cosas son para ti no existirá ningún obstáculo ni prueba que no puedas superar #infinitamenteorgullosa,es,6.934080002,-73.0424375,city,Colombia,,100392023,3075,FALSE,tu,Tue Sep 08 22:41:36 +0000 2015,B/manga-Colombia,"['estudiante', 'de', 'derecho', 'becada', 'en', 'la', 'universidad', 'de', 'la', 'vida', 'namasteu', '2665']"
19083,quiero que tú sepas que aunque tengas dueño tú eres la que me mata tú eres la que yo quiero,es,6.997779996,-73.8367895,city,Colombia,,588749296,469,FALSE,tu,Tue Sep 08 22:50:03 +0000 2015,,"['estudiante', 'de', 'ingeniería', 'fcbu', '2665', 'falcao', '9', 'u26bd', 'potter', 'u26a1']"
19124,estas palabras son pa ti tu nombre no voy a decir eso a ninguno le interesa,es,10.95807288,-74.849933,city,Colombia,,202425237,276,FALSE,tu,Tue Sep 08 23:10:39 +0000 2015,Fonseca  - Barranquilla,"['estudiante', 'de', 'odontología', 'creyente', 'de', 'dios', 'y', 'amante', 'del', 'vallenato']"
19125,quiero mejorar mi errores a tu lado quiero seguir compartiendo contigo salir de la monotonía quiero tenerte conmigo,es,2.988736497,-75.3222715,city,Colombia,,1384883048,313,FALSE,tu,Tue Sep 08 23:11:17 +0000 2015,Colombia - Neiva,"['vivo', 'con', 'música', 'flores', 'libros', 'cultura', 'y', 'cigarros', 'con', 'café', 'estudiante', 'de', 'psicología', 'usco', 'coldplay', 'chelsea', 'habla', 'mierda', 'y', 'no', 'crean', 'todo', 'lo', 'que', 'leen', 'acá']"
19126,un día seré lo que siempre has querido pero ya no seré para ti,es,10.95807288,-74.849933,city,Colombia,,202425237,276,FALSE,tu,Tue Sep 08 23:12:07 +0000 2015,Fonseca  - Barranquilla,"['estudiante', 'de', 'odontología', 'creyente', 'de', 'dios', 'y', 'amante', 'del', 'vallenato']"
19175,es por ti,es,4.262283503,-74.243671,city,Colombia,,157697937,365,FALSE,tu,Tue Sep 08 21:37:16 +0000 2015,,"['estudiante', 'de', 'educación', 'infantil', 'universidad', 'pedagógica', 'nacional']"
19211,intensa tú,es,10.90063338,-74.65783138,city,Colombia,,337331400,316,FALSE,tu,Sun Sep 13 17:07:57 +0000 2015,Barranquilla,"['estudiante', 'de', 'ing', 'industrial', 'bailarina', 'lectora', 'melomana', 'y', 'una', 'chica', 'que', 'intenta', 'ser', 'feliz']"
19216,lt3 se me despierta el amor por ti cada día,es,4.262283503,-74.243671,city,Colombia,,256649008,381,FALSE,tu,Sun Sep 13 17:09:37 +0000 2015,Bogota :3 DC,"['estudiante', 'de', 'contaduria', '313', '894', '50', '81']"
19220,tú felicidad es mi mayor tesoro @ municipio de montelíbano córdoba,es,7.759037502,-75.6924335,city,Colombia,,161381903,112,FALSE,tu,Sun Sep 13 17:10:01 +0000 2015,Colombia,"['estudiante', 'de', 'ingeniería', 'civilupb', 'mi', 'mayor', 'tesoro', 'dios', 'y', 'mi', 'familia', 'me', 'gusta', 'viajar']"
19223,no puedo estar ni un segundo sin ti,es,3.364181997,-76.49608,city,Colombia,,528801163,246,FALSE,tu,Sun Sep 13 17:11:41 +0000 2015,colombia - tunja,"['amor', 'mi', 'vida', 'siempre', 'junto', 'a', 'ti', 'adag', 'estudiante', 'de', 'arquitectura', 'universidad', 'santo', 'tomás']"
19229,tú felicidad es mi mayor tesoro edu 00A0U00BDedU00B8U008D edu 00A0U00BDedU00B8U008D edu 00A0U00BDedU00B8U008D #eliasdavid #regalodedios @ municipio de montelíbano córdoba,es,7.759037502,-75.6924335,city,Colombia,,161381903,112,FALSE,tu,Sun Sep 13 17:13:26 +0000 2015,Colombia,"['estudiante', 'de', 'ingeniería', 'civilupb', 'mi', 'mayor', 'tesoro', 'dios', 'y', 'mi', 'familia', 'me', 'gusta', 'viajar']"
19235,tú felicidad es todo para mi edu 00A0U00BDedU00B8U008D edu 00A0U00BDedU00B8U008D edu 00A0U00BDedU00B8U008D #eliasdavid #regalodedios,es,7.759037502,-75.6924335,city,Colombia,,161381903,112,FALSE,tu,Sun Sep 13 17:17:07 +0000 2015,Colombia,"['estudiante', 'de', 'ingeniería', 'civilupb', 'mi', 'mayor', 'tesoro', 'dios', 'y', 'mi', 'familia', 'me', 'gusta', 'viajar']"
19259,buen dívamos #bocaunidos hoy hay que ganar cueste lo que cueste por tú hinchada por la gloria y por el campeonato vamos que vamos edu 00a0u00bdedu00b2u00aaedu00a0u00bdedu00b1u008au26bdu2714,es,4.448673,-75.3155775,city,Colombia,,188541780,251,FALSE,tu,Sun Sep 13 17:27:43 +0000 2015,Ibagué - Colombia,"['estudiante', 'de', 'comunicación', 'social', 'periodista', 'en', 'formación', 'amante', 'de', 'los', 'deportes', 'hincha', 'fanático', 'de', 'boca', 'jrs', 'hijo', 'de', 'dios', 'xix']"
19274,#tejuroquemecansede esperar mas de ti,es,4.262283503,-74.243671,city,Colombia,,2215093975,110,FALSE,tu,Sun Sep 13 17:32:33 +0000 2015,,"['dios', 'y', 'mi', 'familia', 'estudiante', 'de', 'investigación', 'judicialu', '2764', 'aspirante', 'a', 'la', 'fuerza', 'aérea', 'colombianau', '2708']"
19295,@rodriibentancur vamos pibe es tú oportunidad para demostrar tus dotes de crack edu 00a0u00bdedu00b2u00aaedu00a0u00bdedu00b1u008au26bd,es,4.448673,-75.3155775,city,Colombia,1881138242,188541780,251,FALSE,tu,Sun Sep 13 17:40:31 +0000 2015,Ibagué - Colombia,"['estudiante', 'de', 'comunicación', 'social', 'periodista', 'en', 'formación', 'amante', 'de', 'los', 'deportes', 'hincha', 'fanático', 'de', 'boca', 'jrs', 'hijo', 'de', 'dios', 'xix']"
19297,cuando contigo me encuentro se enreda el pensamiento se me corta la respiración,es,9.315605496,-75.434214,city,Colombia,,217966806,279,FALSE,tu,Sun Sep 13 17:41:07 +0000 2015,sucre colombia,"['de', 'la', 'mano', 'de', 'dios', 'estudiante', 'de', 'medicina', 'u', 'de', 's', 'tenor', '1', 'del', 'coro', 'ars', 'nova', 'u2191u2191', '8', 'u266au266b', 'música', 'y', 'tú', 'me', 'encantas', 'u266a8']"
19335,amor yo te quiero a ti por que me nació quererte edu 00a0u00bcedu00beu00b5edu00a0u00bcedu00bdu00bbu2764,es,10.39044865,-75.5496353,city,Colombia,,537720169,185,FALSE,tu,Sun Sep 13 18:04:27 +0000 2015,"Cartagena, Bolívar","['estudiante', 'de', 'trabajo', 'social', 'y', 'ddhh']"
19362,@ndreaecheverri feliz cumple mujer hermosa valiente auténtica e inspiradora que sean muchos años más de ti en este mundo #mujerreal,es,4.262283503,-74.243671,city,Colombia,437025531,59154586,353,FALSE,tu,Sun Sep 13 18:19:42 +0000 2015,Bogotá,"['mujer', 'con', 'carácter', 'estudiante', 'de', '#periodismo', 'queriendo', 'transmitir', 'realidad', 'y', 'conciencia', 'curiosa', 'por', '#cine', '#series', '#música', '#mediosdigitales', '#wonderwoman']"
19373,contigo el canto del loco,es,4.262283503,-74.243671,city,Colombia,,161423795,652,FALSE,tu,Sun Sep 13 18:21:59 +0000 2015,Bogota,"['aprendí', 'de', 'la', 'manera', 'difícil', 'a', 'callar', 'y', 'a', 'sonreír', 'estudiante', 'de', 'ingenieria', 'civil', 'ugc']"
19418,junto a ti te amo múchisimo @laurafherrera @ valle del cocora salento quindio,es,4.567087498,-75.6021415,city,Colombia,,335522658,115,FALSE,tu,Sun Sep 13 18:47:30 +0000 2015,"Ibague,Colombia","['estudiante', 'de', 'ingeniería', 'risible', 'amante', 'al', 'stand', 'up', 'comedy', 'energía', 'y', 'vibra', 'juan', 'espinosa', 'gz']"
19421,contigo me quedaría la vida entera siendo feliz,es,7.144792999,-73.132697,city,Colombia,,751642820,214,FALSE,tu,Sun Sep 13 18:50:25 +0000 2015,"Bucaramanga, Santander","['estudiante', 'de', 'negocios', 'internacionales', 'ipuc', 'enamorada', 'y', 'bendecida', '100', 'por', 'dios']"
19422,el desespero me mata por ganas de darte un beso quitame por favor estas ganas que vivir sin ti no puedoedu 00a0u00bcedu00beu00b5u2764,es,6.270882998,-75.619213,city,Colombia,,2461753628,130,FALSE,tu,Sun Sep 13 18:50:52 +0000 2015,"Medellín, Antioquia","['estudiante', 'de', 'negocios', 'internacionales']"
19423,después de tanto tiempo te vuelvo a encontrar yo muero por ti no importa lo que diganedu 00a0u00bcedu00beu00b5edu00a0u00bcedu00beu00b6,es,6.270882998,-75.619213,city,Colombia,,334383216,762,FALSE,tu,Sun Sep 13 18:51:13 +0000 2015,"Medellín, Antioquia","['futura', 'estudiante', 'de', 'derecho']"
19452,días así contigo siempre edu 00A0U00BDedU00B8U008D,es,7.144792999,-73.132697,city,Colombia,,751642820,214,FALSE,tu,Sun Sep 13 19:10:39 +0000 2015,"Bucaramanga, Santander","['estudiante', 'de', 'negocios', 'internacionales', 'ipuc', 'enamorada', 'y', 'bendecida', '100', 'por', 'dios']"
19484,lo quiero todo de ti tus labios tu cariño y lo prohibido,es,4.262283503,-74.243671,city,Colombia,,447227837,774,FALSE,tu,Sun Sep 13 19:25:51 +0000 2015,Bogota D.C,"['estudiante', 'de', 'medicina']"
19527,la suerte para triunfar en la vida se llama creer en ti,es,4.262283503,-74.243671,city,Colombia,,388518048,311,FALSE,tu,Sun Sep 13 20:00:29 +0000 2015,Bogota ,"['i', 'am', 'proud', 'of', 'myself', 'for', 'my', 'success', 'and', 'skills', 'i', 'have', 'as', 'a', 'personu', '2708', 'u2601', 'estudiante', 'auxiliar', 'de', 'vuelo', 'asa', '1at']"
19540,nadie me había gustado tanto como tú,es,10.95807288,-74.849933,city,Colombia,,455160128,600,FALSE,tu,Sun Sep 13 20:09:45 +0000 2015,Harry Potter/Colombia/Pizza,"['la', 'danza', 'y', 'el', 'patinaje', 'son', 'mi', 'pasión', 'grupo', 'kvrass', 'estudiante', 'de', 'psicología', 'atlético', 'juniorfcbdani', 'alves', 'instagram', 'tatagonzalezb', '1']"
19573,mi amor no tengas dudas que lo que siento por ti no lo acaba nadieedu 00a0u00bcedu00beu00a4edu00a0u00bdedu00b2u0093,es,10.95807288,-74.849933,city,Colombia,,253575561,1249,FALSE,tu,Sun Sep 13 20:28:02 +0000 2015,B/quilla,"['estudiante', 'de', 'medicina', 'orgullosamente', 'soy', 'de', 'lo', 'mejor', 'del', 'mundo', 'mi', 'guajirau', '2764ufe0f']"
19575,mi amor no sientas dudas que lo que siento por ti no lo acaba nadieedu 00a0u00bcedu00beu00a4edu00a0u00bdedu00b2u0093,es,10.95807288,-74.849933,city,Colombia,,253575561,1249,FALSE,tu,Sun Sep 13 20:28:23 +0000 2015,B/quilla,"['estudiante', 'de', 'medicina', 'orgullosamente', 'soy', 'de', 'lo', 'mejor', 'del', 'mundo', 'mi', 'guajirau', '2764ufe0f']"
19598,soy quien vino hacerte sonreír quien vino hacer parte de ti un loco extraño edu 00a0u00bcedu00beu00a7edu00a0u00bcedu00beu00a4,es,10.8392125,-74.814403,city,Colombia,,562197313,1102,FALSE,tu,Sun Sep 13 20:41:49 +0000 2015,"Malambo, Atlántico","['estudiante', 'de', 'ingenería', 'mecatronica', 'u2665', 'apasionado', 'a', 'la', 'psicología', 'u2665', 'amante', 'a', 'la', 'lectura', 'u2665', 'real', 'madrid', 'u2665', 'merengues', 'u2665', 'hala', 'madrid', 'u2665', 'facebook', 'miller', 'restrepo']"
19599,ven y lléname de ti el vacío del pecho,es,4.262283503,-74.243671,city,Colombia,,186609304,3299,FALSE,tu,Sun Sep 13 20:42:37 +0000 2015,Zoé || Superlitio.,"['estudiante', 'de', 'fisioterapia', 'ngcl', 'juntas', 'somos', 'mas', 'fuertes', 'manuel', 'medrano']"
19603,quiero que cuando tenga razones para llorar aparezcas tú y me des motivos para sonreír,es,11.2312007,-72.994963,city,Colombia,,550535784,3061,FALSE,tu,Sun Sep 13 20:43:28 +0000 2015,            colombia,"['estudiante', 'de', 'contaduría', 'publica', 'universidad', 'de', 'la', 'guajira']"
19604,@acrisperaltam y yo a ti geme tqm,es,10.95807288,-74.849933,city,Colombia,1735222988,149570575,839,FALSE,tu,Sun Sep 13 20:43:52 +0000 2015,Barranquilla ,"['estudiante', 'de', 'medicina', 'universidad', 'simon', 'bolivar']"
19629,jamás pensé enamorarme así de ti ilusionarme y te perdí,es,4.155606001,-74.946231,city,Colombia,,296550175,528,FALSE,tu,Sun Sep 13 20:54:10 +0000 2015,Colombia Tolima ,"['estudiante', 'de', 'ingeniería', 'ambiental', 'udec', 'emmanuelu', '2661uc6c3']"
19630,vivo en la luna por ti siento mil cosas por ti no se me pasa esta nota que estoy sintiendo por ti edu 00a0u00bcedu00beu00a7 du2764ufe0f,es,11.07346239,-73.92732164,city,Colombia,,205068842,384,FALSE,tu,Sun Sep 13 20:55:00 +0000 2015,"Santa Marta, Magdalena","['estudiante', 'de', 'derecho']"
19638,es hermoso compartir contigo cada momento cada aventura pero aún mas hermoso es que dios sostenga,es,5.490470499,-73.38497,city,Colombia,,78620262,311,FALSE,tu,Sun Sep 13 20:59:38 +0000 2015,bogotá,"['lorena', 'preciado', 'estudiante', 'de', 'relaciones', 'internacionales', 'estudios', 'políticos', 'jesus', 'is', 'my', 'inheritance', 'now', 'and', 'alwaysyou', 'and', 'you', 'onlythe', 'first', 'in', 'my', 'heart']"
19639,el mejor sentimiento del mundo es ver sonreír a alguien y saber que tú eres el motivo edu 00a0u00bdedu00b8u00af,es,4.262283503,-74.243671,city,Colombia,,713778600,117,FALSE,tu,Sun Sep 13 21:00:48 +0000 2015,,"['saloméu', '2665', 'si', 'van', 'a', 'poner', 'indirectas', 'para', 'mi', 'le', 'pueden', 'poner', 'mi', 'nombre', 'chiquito', 'abajo', 'es', 'que', 'nunca', 'cojo', 'nada', 'gracias', 'estudiante', 'de', 'hoteleria']"
19646,es hora de entender que se avergüenzan de ti,es,4.489758996,-74.260213,city,Colombia,,1596327150,97,FALSE,tu,Sun Sep 13 21:06:46 +0000 2015,,"['estudiante', 'de', 'contaduría', 'pública', 'mamá', 'de', 'dafne', 'la', 'mejor', 'hija', 'del', 'mundo']"
