,text,lang,place_lat,place_lon,place_type,country,in_reply_to_user_id_str,user_id_str,followers_count,verified,pronoun,created_at,location,description
28022,ya todos pusieron para el trago falta usted #nochimbeeparce,es,4.262283503,-74.243671,city,Colombia,,1614259970,39,FALSE,ud,Mon Jul 27 23:48:19 +0000 2015,"Bogotá, Colombia","['estudiante', 'de', 'administración', 'de', 'empresas']"
28108,ojalá que en toda la sangre que perdí se me halla ido el amor por usted,es,7.063666499,-73.0964135,city,Colombia,,367905297,485,FALSE,ud,Tue Jul 28 11:18:49 +0000 2015,Bucaramanga-Colombia,"['estudiante', 'de', 'bacteriología', 'waiting', 'for', 'that', 'magical', 'silence', '0906', 'kaleth', 'miguel', 'snapchat', 'laugmora']"
28134,a usted se le debió correr la teja para haberme saludado,es,5.490470499,-73.38497,city,Colombia,,729514974,175,FALSE,ud,Mon Jul 27 22:30:37 +0000 2015,,"['estudiante', 'de', 'ing', 'electronica']"
28182,usted no sabe el desorden de emociones que provoca su sonrisa,es,10.95807288,-74.849933,city,Colombia,,305669391,215,FALSE,ud,Mon Jul 27 23:01:11 +0000 2015,"Barranquilla, Colombia","['estudiante', 'de', 'derecho', 'dios', 'mi', 'familia', 'y', 'junioru', '2665']"
28217,sí usted es de los que necesita diez alarmas y dos baldeados de agua fría para levantarse a esta hora chóquelas usted es de los míos u270b,es,6.270882998,-75.619213,city,Colombia,,1543562292,203,FALSE,ud,Wed Jul 29 10:17:13 +0000 2015,"Medellín, Antioquia. ","['estudiante', 'de', 'no', 'sé', 'qué', 'tengo', '21', 'años', 'tampoco', 'sé', 'en', 'dónde', 'pero', 'los', 'tengo', 'comer', 'y', 'dormir', 'mis', 'pasiones']"
28223,para mi usted era tan perfecto hasta que la embarro,es,3.570428504,-76.3486225,city,Colombia,,421304680,680,FALSE,ud,Wed Jul 29 10:47:49 +0000 2015,"Shakilandia, Alaska","['bailarina', 'de', 'danza', 'árabe', 'estudiante', 'de', 'enfermería', 'shakifanu', '2665', 'barcelona', 'u26bd', 'enamorada', 'de', 'elu', '26bd']"
28239,si usted no quiere nada conmigo no es necesario de que pongas palabras en mi boca que yo no he dicho solo basta con que me lo diga,es,3.570428504,-76.3486225,city,Colombia,,729855529,107,FALSE,ud,Wed Jul 29 11:50:54 +0000 2015,,"['mjga', 'mpaq', 'te', 'amo', 'tú', 'eres', 'lo', 'mejor', 'de', 'mi', 'mundo', 'att', 'tu', 'enana', 'estudiante', 'de', 'comunicación', 'social', 'fútbol', 'club', 'barcelona', 'delirios', 'de', 'argentino', '#arg']"
28259,@manuel027 jajaj tutee bien primero que todo y segundo ud ya me olvido me sacó de su vida pero tranquilo bb,es,4.262283503,-74.243671,city,Colombia,285844143,133060986,182,FALSE,ud,Wed Jul 29 12:37:09 +0000 2015,Bogotá,"['estudiante', 'de', 'relaciones', 'económicas', 'internacionales']"
28282,yo no sé que hice mal con usted para que se comporte de esa manera,es,7.063666499,-73.0964135,city,Colombia,,1365579025,111,FALSE,ud,Tue Jul 28 22:12:35 +0000 2015,,"['estudiante', 'de', 'gestión', 'de', 'mercados', 'whatsapp', '3142789063']"
28304,@lissadhl sapa jaja prima ud sabe q a mi dulce hogar es bienvenida con 2mil de pan para hacer chocolate jaja,es,3.226721001,-75.445396,city,Colombia,1643702875,1455541939,390,FALSE,ud,Tue Jul 28 22:36:25 +0000 2015,Ibague Tolima,"['estudiante', 'de', 'ingeniería', 'civil']"
28339,#sientasemuyimportanteparami porque siempre dejo todo botado por ud,es,4.262283503,-74.243671,city,Colombia,,302836428,80,FALSE,ud,Thu Jul 30 00:54:30 +0000 2015,Colombia,"['estudiante', 'de', 'psicología', 'apasionada', 'por', 'la', 'música', 'y', 'la', 'lectura', 'en', 'especial', 'poesía']"
28497,cuando yo haga usted trague y mastique oyó bueno pué,es,8.794049501,-75.4192115,city,Colombia,,378288629,1566,FALSE,ud,Thu Jul 30 02:11:36 +0000 2015,Valledupar-Colombia,"['snapchat', 'majobrito', '25', 'instagram', 'majobrito', '13', 'estudiante', 'de', 'psicología']"
28509,yo a usted no lo cambio por nada,es,4.262283503,-74.243671,city,Colombia,,979554133,536,FALSE,ud,Thu Jul 30 02:15:36 +0000 2015,"Bogota, Colombia ","['estudiante', 'de', 'administración', 'ambiental', 'ud']"
28523,no se a usted pero a mi si me indispone,es,4.262283503,-74.243671,city,Colombia,,298268387,117,FALSE,ud,Thu Jul 30 00:10:54 +0000 2015,,"['reina', 'del', 'drama', 'estudiante', 'contabilidad', 'finanzas', 'y', 'administración', 'de', 'negocios']"
28530,cuando hablemos no me digas mi qk pa usted #nolohagasesraro,es,4.262283503,-74.243671,city,Colombia,,332587815,1168,FALSE,ud,Thu Jul 30 00:14:36 +0000 2015,Bogotá D.C,"['estudiante', 'de', 'publicidad', 'independiente', 'santa', 'feu', '2665', '15072012', '2112201', '4']"
28622,oiga si usted me encanta verlo jugar,es,4.262283503,-74.243671,city,Colombia,,846109832,364,FALSE,ud,Wed Jul 29 23:23:43 +0000 2015,,"['estudiante', 'de', 'comunicación', 'social', 'y', 'periodismo', 'instagramfernandalgg']"
28635,que rico estar con usted 247,es,4.262283503,-74.243671,city,Colombia,,846109832,364,FALSE,ud,Wed Jul 29 23:28:21 +0000 2015,,"['estudiante', 'de', 'comunicación', 'social', 'y', 'periodismo', 'instagramfernandalgg']"
28690,@valensanchez54 jajajajajajaja boba es que el amor me tiene mal y usted que no me habla por wpp menos,es,4.434799002,-75.779453,city,Colombia,212767831,843846570,782,FALSE,ud,Thu Jul 30 00:07:56 +0000 2015,,"['estudiante', 'de', 'salud', 'ocupacional']"
28705,si usted se llama luisa y se apellida lovera #sientasemuyimportanteparami,es,4.909635999,-74.0487635,city,Colombia,,426745584,584,FALSE,ud,Thu Jul 30 02:46:50 +0000 2015,,"['estudiante', 'de', 'psicología', 'u03a8almamente', 'y', 'corazon', 'millonarios', 'fc', 'voleibol', 'don', 'tetto']"
28717,me duelen los pieeeesss necesito un masaje de esos q me da ud en su casa,es,4.762178502,-75.72812,city,Colombia,,172799328,262,FALSE,ud,Thu Jul 30 02:52:48 +0000 2015,"Pereira, Colombia","['estudiante', 'de', 'ingeniería', 'electrónica', 'utp']"
28732,@neira a mi me toca todo el día igual a usted lemtoca madrugar,es,4.434799002,-75.779453,city,Colombia,1151808252,226180983,2917,FALSE,ud,Thu Jul 30 02:58:05 +0000 2015,Armenia - Quindio - Colombia,"['estudiante', 'de', 'biología', 'universidad', 'del', 'quindio', 'breakbeat', 'techno']"
28820,siempre doy lo mejor de mí depende de usted si cambio o no,es,4.262283503,-74.243671,city,Colombia,,106854302,124,FALSE,ud,Thu Jul 30 01:39:14 +0000 2015,Bogotá-Colombia,"['estudiante', 'de', 'comunicación', 'social', 'amante', 'de', 'la', 'escritura', 'y', 'por', 'supuesto', 'del', 'fútbol', '19', 'de', 'abril']"
28849,yo perdí una vez mi orgullo enviándole un mensaje esperó que esta vez sea usted quien lo haga,es,4.262283503,-74.243671,city,Colombia,,707466541,323,FALSE,ud,Thu Jul 30 01:51:33 +0000 2015,Bogota-Colombia.,"['estudiante', 'de', 'bancaria', 'y', 'finanzas', 'whatsapp', '3214156746']"
28882,#yomecomprometo a que en octubre dar un #votoaconciencia y un #votolimpio y usted mi amigo,es,6.360579503,-75.606961,city,Colombia,,282280016,167,FALSE,ud,Thu Jul 30 02:00:10 +0000 2015,"Medellin,Antioquia,Colombia","['estudiante', 'de', 'historia', 'de', 'la', '@udea', 'las', 'opiniones', 'expresadas', 'son', 'personales', 'y', 'no', 'comprometen', 'a', 'nadie', 'liberal', 'radical', 'gaitanista', 'polista', 'y', 'verde']"
28903,@dacp ni usted en las mías,es,4.262283503,-74.243671,city,Colombia,753412506,1621748718,5049,FALSE,ud,Fri Jul 31 18:30:11 +0000 2015,"Ibagué, Tolima","['instagram', 'uncoquetodice', 'aunque', 'me', 'falles', 'nunca', 'te', 'dejaré', 'toda', 'la', 'vida', 'yo', 'te', 'voy', 'a', 'querer', 'cdt', 'estudiante', 'ing', 'sistemas']"
28997,no coma cuento bebé que él de usted no habló maravillas,es,6.448029002,-73.2685195,city,Colombia,,2392884078,165,FALSE,ud,Fri Jul 31 19:24:29 +0000 2015,"Bucaramanga, Santander","['el', 'tiempo', 'de', 'dios', 'es', 'perfectou', '2764', 'estudiante', 'de', 'administración', 'de', 'empresas', 'snapchat', 'e', 'instagram', 'andrepardob']"
29078,@elsebasvega @alejitavarela a ud le pasan las dos,es,1.075555498,-77.170498,city,Colombia,3158219878,1222259766,148,FALSE,ud,Fri Jul 31 22:10:42 +0000 2015,"Cali, Colombia ","['amante', 'del', 'derecho', 'y', 'todos', 'sus', 'componentes', 'estudiante', 'de', 'derecho', 'y', 'ciencia', 'política', 'universidad', 'libre']"
29156,yo solo tengo ojos pa usted,es,1.803009839,-78.61665738,city,Colombia,,360368304,302,FALSE,ud,Fri Jul 31 20:13:34 +0000 2015,"Palmira, Colombia","['aprendiendo', 'a', 'ser', 'fuerte', 'estudiante', 'de', 'ingeniería', 'ambiental', 'en', 'la', 'un', 'tumaqueña', 'de', 'corazónu', '2665dios', 'y', 'mi', 'madre', 'antes', 'que', 'todou', '2665', 'instagram', 'andrealopezleon']"
29173,que quede claro que usted y yo nunca nos vimos ni nos conocemos,es,4.448673,-75.3155775,city,Colombia,,610493575,391,FALSE,ud,Fri Jul 31 20:34:53 +0000 2015,"Ibagué, Tolima","['estudiante', 'de', 'comunicación', 'social', 'y', 'periodismo']"
29188,que sean cuatro que sean cinco seis o siete las que sea a usted le tienen uno igual o peor,es,6.448029002,-73.2685195,city,Colombia,,2392884078,167,FALSE,ud,Sun Aug 02 13:58:54 +0000 2015,"Bucaramanga, Santander","['el', 'tiempo', 'de', 'dios', 'es', 'perfectou', '2764', 'estudiante', 'de', 'administración', 'de', 'empresas', 'snapchat', 'e', 'instagram', 'andrepardob']"
29193,@juanval07 @sernajuan13 ud no que había pasado a la u jajajaja mucha locha parce jajaja nonono tenia esperanzas de encontrarmela por allá,es,4.811547,-75.6123815,city,Colombia,1328259073,551286544,289,FALSE,ud,Sun Aug 02 16:42:25 +0000 2015,"Pereira, Colombia","['estudiante', 'ing', 'sistemas', 'utp']"
29197,@sernajuan13 @juanval07 a pero son esos de la tarde ud tiene wpp jajaja,es,4.811547,-75.6123815,city,Colombia,1135726238,551286544,289,FALSE,ud,Sun Aug 02 16:45:57 +0000 2015,"Pereira, Colombia","['estudiante', 'ing', 'sistemas', 'utp']"
29244,usted me fastidia tanto que hasta un hola suyo se me tira todo el día,es,4.262283503,-74.243671,city,Colombia,,339068559,469,FALSE,ud,Sun Aug 02 17:31:58 +0000 2015,Bogotá,"['estudiante', 'de', 'publicidad', 'universidad', 'central']"
29268,yo quiero ser de usted solamente,es,4.0882915,-73.4704055,city,Colombia,,1928303586,254,FALSE,ud,Sun Aug 02 17:55:25 +0000 2015,"Villavicencio, Meta","['estudiante', 'de', 'enfermeria', 'instagram', '@gerall02']"
29374,aunque todo sería perfecto con usted,es,4.262283503,-74.243671,city,Colombia,,375089068,477,FALSE,ud,Sun Aug 02 22:24:02 +0000 2015,Nocheósfera.,"['081012', 'eres', 'mi', 'vida', 'antisocial', 'acomplejada', 'marginada', 'coulrofobica', 'eisoptrofobica', 'estudiante', 'de', 'comunicación', 'social', 'y', 'crespa']"
29393,usted fue siempre así,es,7.144792999,-73.132697,city,Colombia,,1074905334,276,FALSE,ud,Sun Aug 02 22:47:21 +0000 2015,Colombia,"['cienciaarte', 'estudiante', 'de', 'química', 'uis']"
29482,no se que sea eso pero estoy alegre de que usted este bien y se sienta querido y hoy por fin pude sonreír al verle y sin odio ni rencor,es,7.063666499,-73.0964135,city,Colombia,,1385205661,391,FALSE,ud,Mon Aug 03 17:25:28 +0000 2015,Bucaramanga/Santander,"['estudiante', 'de', 'comunicación', 'social']"
29500,musica en los oidos juegos de pc en las manos y ud en mi cabeza,es,4.762178502,-75.72812,city,Colombia,,172799328,263,FALSE,ud,Mon Aug 03 17:57:28 +0000 2015,"Pereira, Colombia","['estudiante', 'de', 'ingeniería', 'electrónica', 'utp']"
29541,feliz día para usted que leyó esto sin querer energía positiva y las mejores vibras,es,6.270882998,-75.619213,city,Colombia,,2815802585,40,FALSE,ud,Mon Aug 03 14:50:16 +0000 2015,"Bucaramanga, Santander","['estudiante', 'de', 'negocio', 'internacionalme', 'gusta', 'viaja', 'y', 'el', 'fútbol', 'es', 'lo', 'mio']"
29613,póngase de pie y apláudase con orgullo por que solo usted sabe lo que ha tenido que hacer para conseguir lo que tiene,es,4.262283503,-74.243671,city,Colombia,,134857921,508,FALSE,ud,Mon Aug 03 01:26:20 +0000 2015,"Bogotá D.C, Colombia.","['investigador', 'judicialcentro', 'internacional', 'forense', 'estudiante', 'de', 'derechouniversidad', 'militar', 'nueva', 'granada', 'kp30']"
29645,si no va a estar con ud en las malas mejor que ni este,es,4.262283503,-74.243671,city,Colombia,,139534482,85,FALSE,ud,Mon Aug 03 01:46:27 +0000 2015,Bogotá,"['estudiante', 'y', 'futuro', 'publicista', 'ind', 'santafe']"
29660,baje el ego socio que usted estudia en la remington jajajajajaja,es,5.490470499,-73.38497,city,Colombia,,205463576,222,FALSE,ud,Mon Aug 03 15:49:13 +0000 2015,Tunja Colombia,"['estudiante', 'de', 'ingeniería', 'mecánica', 'universidad', 'santo', 'tomás']"
29669,@ingjohn paguelo con credinalga jajajajajajaja se le nota q ud paga generalmente con eso,es,4.262283503,-74.243671,city,Colombia,67826324,57359500,144,FALSE,ud,Mon Aug 03 15:54:25 +0000 2015,Bogota,"['estudiante', 'de', 'ingenieria', 'civil', 'en', 'la', '@ucatolicacol']"
29784,ya no sabia que escoger si estar sola o estar con usted que se siente casi igual,es,4.262283503,-74.243671,city,Colombia,,208152899,214,FALSE,ud,Sun Aug 02 23:31:44 +0000 2015,Bogotá,"['estudiante', 'de', 'enfermeria', 'superior', 'fucs', 'si', 'hablas', 'en', 'diminutivo', 'sueñas', 'en', 'diminutivo', 'untouched', 'mispapasyaleja', '26forever', 'amolosniñoslosbebeslosontodoenmividau', '2665']"
29797,el la iba a sacar a bailar y usted se fue casi corriendo jajaja,es,6.270882998,-75.619213,city,Colombia,,111919387,160,FALSE,ud,Sun Aug 02 23:39:40 +0000 2015,Medellin - Colombia,"['estudiante', 'de', 'geología', 'en', 'universidad', 'eafit']"
29811,si ud es de lo que saca un clavo con otro realmente tiene ganas es de otra cosa,es,4.262283503,-74.243671,city,Colombia,,219815761,156,FALSE,ud,Sun Aug 02 23:48:16 +0000 2015,Colombia,"['estudiante', 'de', 'ingenieria', 'geográfica', 'y', 'ambiental']"
29893,usted prefiere las cosas materiales y se le olvida que el mundo existe #vayaycomamierda,es,4.262283503,-74.243671,city,Colombia,,287486874,555,FALSE,ud,Mon Aug 03 01:13:20 +0000 2015,Colombia,"['z11u26bd', 'hincha', 'del', 'primer', 'campeón', 'estudiante', 'de', 'derecho']"
29910,#sinustedyo ni mierda con o sin usted la vida sigue,es,4.448673,-75.3155775,city,Colombia,,1621748718,5155,FALSE,ud,Mon Aug 03 01:55:07 +0000 2015,"Ibagué, Tolima","['instagram', 'uncoquetodice', 'aunque', 'me', 'falles', 'nunca', 'te', 'dejaré', 'toda', 'la', 'vida', 'yo', 'te', 'voy', 'a', 'querer', 'cdt', 'estudiante', 'ing', 'sistemas']"
29923,#name,es,4.262283503,-74.243671,city,Colombia,,287486874,555,FALSE,ud,Mon Aug 03 02:02:26 +0000 2015,Colombia,"['z11u26bd', 'hincha', 'del', 'primer', 'campeón', 'estudiante', 'de', 'derecho']"
29931,que tal si te robo un beso de esos esquineados a quien le quiero mentir si ud me tiene tragado,es,4.262283503,-74.243671,city,Colombia,,105583512,621,FALSE,ud,Mon Aug 03 02:05:34 +0000 2015,Bogotá-Colombia,"['ibaguereñau', '2665', 'estudiante', 'de', 'jurisprudencia', 'urosario']"
29950,oiga usted me reviso mi celular verdad oigan ha esta que tal,es,4.262283503,-74.243671,city,Colombia,,2417910380,556,FALSE,ud,Mon Aug 03 02:16:00 +0000 2015,,"['estudiante', 'de', 'bacteriología', 'y', 'laboratorio', 'clínico', 'millonarios', 'fc']"
29982,como dijo mi profesor de paleontología ud sabe si su novio la quiere por las ganas que el le tenga,es,7.144792999,-73.132697,city,Colombia,,390176529,141,FALSE,ud,Tue Aug 04 18:27:27 +0000 2015,Bucaramanga,"['estudiante', 'de', 'geología', 'loca', 'enamorada', 'de', 'mi', 'ángel', 'ese', 'ser', 'de', 'cuatro', 'patitas', 'cuerpo', 'peludo', 'y', 'amarillo', 'ojos', 'grandes', 'y', 'nariz', 'negra']"
30003,usted siempre será parte de mi vida,es,10.7207795,-74.7980215,city,Colombia,,416512791,339,FALSE,ud,Tue Aug 04 18:44:47 +0000 2015,,"['estudiante', 'contaduría', 'públicau', '270c', 'loves', 'godu', '2665', '#junioristau26bd', '#kalethista', '#haash1f']"
30021,@elfuicioso mca ud tiene razón,es,6.997779996,-73.8367895,city,Colombia,2563986096,433653134,507,FALSE,ud,Tue Aug 04 18:56:10 +0000 2015,Colombia,"['estudiante', 'de', 'la', 'facultad', 'de', 'medicina', 'veterinaria', 'y', 'zootecnia', 'fraternidad', 'unipaz', 'casi', 'psicólogo', 'y', 'escritor', 'whatsapp', '3214002764']"
30023,@juanchoyos7 la buena para usted camilo,es,5.056934001,-75.560285,city,Colombia,2222317374,291207591,537,FALSE,ud,Tue Aug 04 19:00:51 +0000 2015,MANIZALES,"['estudiante', 'deportista', 'dedicado', 'a', 'lograr', 'una', 'meta', 'profesional', 'whatsapp', '3128594088']"
30040,no no es tu malgenio no te preocupes es que usted es muy fastidiosao,es,4.262283503,-74.243671,city,Colombia,,319755494,338,FALSE,ud,Tue Aug 04 17:18:53 +0000 2015,Bogota - colombia,"['estudiante', 'dj', 'profesional', 'youtuber', 'suscribanse']"
30051,usted ya también les pusieron trabajos de la u,es,6.270882998,-75.619213,city,Colombia,,2461753628,127,FALSE,ud,Tue Aug 04 17:31:27 +0000 2015,"Medellín, Antioquia","['estudiante', 'de', 'negocios', 'internacionales']"
30073,si lleva mas de un año con su novio y el aun no se lo ha pedido ud debe ser muy insipida,es,7.144792999,-73.132697,city,Colombia,,390176529,141,FALSE,ud,Tue Aug 04 17:56:24 +0000 2015,Bucaramanga,"['estudiante', 'de', 'geología', 'loca', 'enamorada', 'de', 'mi', 'ángel', 'ese', 'ser', 'de', 'cuatro', 'patitas', 'cuerpo', 'peludo', 'y', 'amarillo', 'ojos', 'grandes', 'y', 'nariz', 'negra']"
30090,@diannacha gracias por a usted y la felicito por el apoyo a su hijo debe ser muy feliz,es,4.262283503,-74.243671,city,Colombia,242313241,268373228,875,FALSE,ud,Tue Aug 04 16:14:16 +0000 2015,Colombia,"['#matrimonioigualitario', 'amo', 'a', 'katnissu', '2665jlawu2665', 'u263a', 'estudiante', 'lector']"
30189,@47karl usted no quiere aceptar que en el fútbol hay maricas jajajaja ay déjelos les gusta la puya loca jajaja xdd y patear balón jaja,es,7.063666499,-73.0964135,city,Colombia,627769432,3312039497,168,FALSE,ud,Tue Aug 04 22:14:26 +0000 2015,"Bucaramanga, Santander","['estudiante', 'de', 'ingeniería', 'electromecánica', '22', 'años', 'jesus', 'is', 'love']"
30208,lo peor usted como persona @,es,4.262283503,-74.243671,city,Colombia,,362797942,1150,FALSE,ud,Tue Aug 04 22:28:14 +0000 2015,Bogotá DC.,"['estudiante', 'de', 'gastronomía', 'whatsapp', '3203545631']"
30222,el problema llega cuando usted sigue queriendo igual y la otra persona no,es,4.0882915,-73.4704055,city,Colombia,,1928303586,258,FALSE,ud,Tue Aug 04 22:38:24 +0000 2015,"Villavicencio, Meta","['estudiante', 'de', 'enfermeria', 'instagram', '@gerall02']"
30277,si yo no quise con usted no tiene porque meterse en mis cosas,es,5.056934001,-75.560285,city,Colombia,,200571891,362,FALSE,ud,Tue Aug 04 23:07:02 +0000 2015,Colombia,"['estudiante', 'de', 'ingeniería', 'industrial', 'universidad', 'nacional', 'de', 'colombia', 'soy', 'un', 'lizantropo', 'altruista', 'que', 'se', 'la', 'pasa', 'domando', 'las', 'angustias']"
30284,tal vez yo perdí la dignidad rogando pero usted perdió a alguien que no le importo perder su dignidad por no perderte,es,4.0882915,-73.4704055,city,Colombia,,1928303586,258,FALSE,ud,Tue Aug 04 23:14:42 +0000 2015,"Villavicencio, Meta","['estudiante', 'de', 'enfermeria', 'instagram', '@gerall02']"
30287,tal vez yo perdí la dignidad rogando pero usted perdió a alguien que no le importo perder su dignidad por no perderlo,es,4.0882915,-73.4704055,city,Colombia,,1928303586,258,FALSE,ud,Tue Aug 04 23:15:11 +0000 2015,"Villavicencio, Meta","['estudiante', 'de', 'enfermeria', 'instagram', '@gerall02']"
30296,si a usted se le va un fav o like no lo quite no sea ridículo,es,7.144792999,-73.132697,city,Colombia,,217986351,280,FALSE,ud,Tue Aug 04 23:24:10 +0000 2015,colombia,"['estudiante', 'de', 'comunicación', 'socialunab', 'amante', 'de', 'la', 'política']"
30347,usted envejece como el vino entre mas viejo más rico jajajajajaja lol,es,8.075581894,-72.4770928,city,Colombia,,184813662,202,FALSE,ud,Tue Aug 04 23:52:42 +0000 2015,"Cúcuta,Colombia","['cambia', 'el', 'mundo', 'a', 'tu', 'mejor', 'manera', 'diseñador', 'industrial', 'estudiante', 'ing', 'biotecnologíca', 'instagram', '@sebasmarquez']"
30354,usted tiene cara de que le gusta eso poncha via @jeffer1005,es,7.748680501,-74.290233,city,Colombia,,393776410,149,FALSE,ud,Tue Aug 04 23:55:24 +0000 2015,"Barrancabermeja, Santander","['estudiante', 'de', 'la', 'universidad', 'industrial', 'de', 'santander', '#uis']"
30429,enamorese de usted y de la vida luego del que se le de la gana,es,4.812912999,-75.737506,city,Colombia,,400483080,102,FALSE,ud,Wed Aug 05 00:26:48 +0000 2015,Pereira,"['estudiante', 'de', 'cdyr', 'utp']"
30459,usted le devuelve la paz a mi alma con solo un beso,es,4.262283503,-74.243671,city,Colombia,,327739646,337,FALSE,ud,Wed Aug 05 00:37:33 +0000 2015,Orgullosamente Colombiana,"['estudiante', 'de', 'química', 'industrial', '#cepedista']"
30466,querido vecino si va a preparar veneno para perro pruebelo usted primero,es,10.3244505,-73.463286,city,Colombia,,155647657,521,FALSE,ud,Wed Aug 05 00:41:15 +0000 2015,"Valledupar, Cesar","['estudiante', 'de', 'derecho', 'mama', 'de', 'enriqueandresu', '2665']"
30541,ay si ay si a ud le mantiene pasando mil cosas con el celular,es,3.421298498,-76.677833,city,Colombia,,566828958,761,FALSE,ud,Wed Aug 05 01:16:27 +0000 2015,,"['estudiante', 'de', 'derecho', 'universidad', 'javeriana']"
30547,@paulamedina lo que me gasto de allá usted tambien se lo gasta jajaja no pues de una en la 80 me queda hasta cerca y todo jaja,es,4.262283503,-74.243671,city,Colombia,255576185,2971687084,71,FALSE,ud,Wed Aug 05 01:20:36 +0000 2015,,"['estudiante', 'de', 'derecho']"
30602,si usted usa twitter como medio de desahogo #ustedesdelosmios,es,4.262283503,-74.243671,city,Colombia,,3365271449,141,FALSE,ud,Wed Aug 05 01:44:55 +0000 2015,"Bogotá, Colombia","['estudiante', 'de', 'comunicación', 'social', 'y', 'periodismo', 'con', 'delirios', 'de', 'youtuber', 'un', 'día', 'lo', 'soñé', 'un', 'día', 'lo', 'logré', '#ustedesdelosmios']"
30613,usted es ununa pendejopendeja,es,4.262283503,-74.243671,city,Colombia,,314974581,337,FALSE,ud,Wed Aug 05 01:50:03 +0000 2015,,"['abusadora', 'del', 'tiempo', 'fan', 'de', 'las', 'buenas', 'historias', 'amante', 'del', 'cine', 'y', 'soñadora', 'entre', 'palabras', 'estudiante', 'de', 'fisioterapia', 'universidad', 'de', 'la', 'sabana']"
30784,yo conteniéndome cuando usted comienza con ese carácter todo maluco,es,4.262283503,-74.243671,city,Colombia,,375089068,478,FALSE,ud,Thu Aug 06 15:29:45 +0000 2015,Nocheósfera.,"['081012', 'eres', 'mi', 'vida', 'antisocial', 'acomplejada', 'marginada', 'coulrofobica', 'eisoptrofobica', 'estudiante', 'de', 'comunicación', 'social', 'y', 'crespa']"
30801,@laurapedraza quien quita que usted tenga algo que esas mocositas no,es,7.144792999,-73.132697,city,Colombia,1928926454,788274193,329,FALSE,ud,Thu Aug 06 15:53:58 +0000 2015,"Santander, Colombia","['breaking', 'bad', 'dexter', 'house', 'american', 'horror', 'story', 'estudiante', 'de', 'medicina']"
30810,si no te gusta tu vida camibala pero cambiala de vd piensa pero sobre todo actúa,es,6.997779996,-73.8367895,city,Colombia,,254598104,141,FALSE,ud,Thu Aug 06 15:58:41 +0000 2015,"Barrancabermeja, Santander","['estudiante', 'de', 'administración', 'de', 'negocios', 'internacionales', 'instrumentista', 'industrial']"
30818,es que usted sonríe y a mi se me olvida todo,es,10.95807288,-74.849933,city,Colombia,,1072497294,440,FALSE,ud,Thu Aug 06 16:05:34 +0000 2015,Barranquilla - Colombia,"['pecosa', 'estudiante', 'de', 'asistente', 'de', 'administraciónu', '2665todo', 'con', 'el', 'favor', 'de', 'dios', 'futura', 'psicologa', 'y', 'cosmetologa', 'tia', 'de', 'un', 'hermoso', 'niño', '24', 'de', 'mayo', 'juan', 'david']"
30823,venga yo soy su nada y todo lo que usted quiera bebé,es,8.197165001,-73.421408,city,Colombia,,394102307,266,FALSE,ud,Thu Aug 06 16:12:22 +0000 2015,"ocaña,colombia.","['venezolana', 'estudiante', 'de', 'ingeniería', 'de', 'sistemas', 'en', 'formación', 'ocañau', '2764']"
30898,usted no tiene idea lo que es estar cansado y ni siquiera dormir entrar en coma si no ha babeado su almohada eso es dormir profundamente,es,4.262283503,-74.243671,city,Colombia,,101282407,326,FALSE,ud,Mon Aug 10 19:22:12 +0000 2015,Bogotá,"['andinoklasse', '2011', '8musics', 'the', 'medicine', '8', 'cantante', 'y', 'estudiante', 'ur', 'medicina', 'hear', 'my', 'covers', 'on', 'youtube', 'luifi', '24', 'soundcloud', 'link', 'bellow']"
30921,tyga le regaló un ferrari a la novia y usted no tiene ni para pagarme la carrera del taxi,es,4.262283503,-74.243671,city,Colombia,,234173403,275,FALSE,ud,Mon Aug 10 19:33:30 +0000 2015,"Bogotá, Colombia","['estudiante', 'de', 'artes', 'escénicas', 'instagram', 'silviij', '2']"
30938,que putas hago si no dejo de pensar en usted,es,5.056934001,-75.560285,city,Colombia,,200582387,223,FALSE,ud,Mon Aug 10 19:49:00 +0000 2015,Colombia ,"['estudiante', 'de', 'administración', 'de', 'empresas', 'universidad', 'nacional', 'de', 'colombia']"
31015,mija usted que estudia derecho vaya y me firma la asistencia en la asamblea de la unidad,es,3.364181997,-76.49608,city,Colombia,,278780652,175,FALSE,ud,Mon Aug 10 20:32:21 +0000 2015,Cali colombia ,"['estudiante', 'de', 'derecho', 'de', 'la', 'puj']"
31023,parce usted es mas fastidioso que culiar con diarrea jajaja,es,4.812912999,-75.737506,city,Colombia,,276147834,209,FALSE,ud,Mon Aug 10 20:43:04 +0000 2015,COLOMBIA.,"['ególatra', 'estudiante', 'de', 'ingeniería', 'civil']"
31043,oye te pasa algo si estoy algo triste ah parce pero no este triste uyy que consejo tan hijueputa usted no ha pensado en ser psicólogo,es,4.262283503,-74.243671,city,Colombia,,2559437279,112,FALSE,ud,Mon Aug 10 21:04:44 +0000 2015,Bogota,"['estudiante', 'de', 'trabajo', 'social', 'en', 'universidad', 'de', 'la', 'salle']"
31065,ahora si no entendí una mierda y no la entiendo a usted,es,4.812912999,-75.737506,city,Colombia,,603825536,132,FALSE,ud,Mon Aug 10 21:21:22 +0000 2015,,"['estudiante', 'de', 'ingeniería', 'industrial', 'utp']"
