,text,lang,place_lat,place_lon,place_type,country,in_reply_to_user_id_str,user_id_str,followers_count,verified,pronoun,created_at,location,description
9193,@loresanchezz24 yo a ti muchísimo más ayer no pare de repetirla hasta quedar dormido,es,4.312452,-74.4376075,city,Colombia,2417625404,220508332,414,FALSE,tu,Fri Aug 14 17:15:05 +0000 2015,Colombia,"['estudiante', 'de', 'derecho', 'asot', 'edm', 'américa', 'de', 'cali', 'fc', 'barça', 'nunca', 'pares', 'nunca', 'te', 'conformes', 'hasta', 'que', 'lo', 'bueno', 'sea', 'mejor', 'y', 'lo', 'mejor', 'excelente']"
9199,pienso en ti y lo demás está de más,es,4.312452,-74.4376075,city,Colombia,,220508332,414,FALSE,tu,Fri Aug 14 17:17:15 +0000 2015,Colombia,"['estudiante', 'de', 'derecho', 'asot', 'edm', 'américa', 'de', 'cali', 'fc', 'barça', 'nunca', 'pares', 'nunca', 'te', 'conformes', 'hasta', 'que', 'lo', 'bueno', 'sea', 'mejor', 'y', 'lo', 'mejor', 'excelente']"
9205,el mundo es tan moderno q la ciencia puede clonar en ti otro talento pero jamas en mi y en mi conciencia podrían modificar mis sentimientos,es,10.95807288,-74.849933,city,Colombia,,573346832,306,FALSE,tu,Fri Aug 14 17:19:45 +0000 2015,Barranquilla,"['de', 'villanueva', 'guajira', 'estudiante', 'de', 'derechooo']"
9210,si yo volviera a vivir estoy seguro mujer q me quedo contigo aunque tampoco reniego dl tiempo perdido con otros falsos amores dond me perdí,es,10.95807288,-74.849933,city,Colombia,,573346832,306,FALSE,tu,Fri Aug 14 17:22:38 +0000 2015,Barranquilla,"['de', 'villanueva', 'guajira', 'estudiante', 'de', 'derechooo']"
9214,titulo todo es para ti intérprete diomedes diaz compositor calixto ochoa album todo es para ti,es,10.95807288,-74.849933,city,Colombia,,1606845890,288,FALSE,tu,Fri Aug 14 17:26:16 +0000 2015,Barranquilla - Colombia,"['locutor', 'de', 'radio', 'lo', 'que', 'he', 'querido', 'ser', 'estudiante', 'de', 'ing', 'industrial', 'ua', 'juniorista', 'de', 'corazón', 'u2764u26bd', 'seguidor', 'del', 'real', 'madrid', 'river', 'plate', 'y', 'milán']"
9260,todo lo que llega a tu vida es porque tú lo has atraído,es,7.356692002,-72.6948055,city,Colombia,,419233233,333,FALSE,tu,Fri Aug 14 18:04:02 +0000 2015,Colombia,"['estudiante', 'de', 'ingeniería', 'mecánica', 'dedicada', 'en', 'cuerpo', 'y', 'alma', 'a', 'mi', 'familia', 'vivo', 'mi', 'vida', 'al', 'maximo']"
9262,@chonegulfo sigo esperando por ti,es,6.270882998,-75.619213,city,Colombia,257734070,532557688,370,FALSE,tu,Fri Aug 14 18:04:52 +0000 2015,MEDELLIN ,"['sembrando', 'amor', 'u2764ufe0f', 'estudiante', 'de', 'medicina']"
9314,sinceramente me gusta todo de ti,es,10.3244505,-73.463286,city,Colombia,,197164327,1246,FALSE,tu,Fri Aug 14 18:34:30 +0000 2015,Valledupar,"['estudiante', 'de', 'psicología', 'analítico', 'y', 'lector', 'prensa', 'de', '@origenvalledupa']"
9328,yo no quiero que otro hombre toque tus labios yo soy el único que a ti te ha besado no dañes esa pureza piénsalo mi amor,es,4.448673,-75.3155775,city,Colombia,,220834696,795,FALSE,tu,Fri Aug 14 18:39:03 +0000 2015,"Ibague, Tolima","['estudiante', 'de', 'derecho']"
9335,me pierdo entre la gente y pienso en ti y entiendo que mi amor no estas aquí u2665,es,7.063666499,-73.0964135,city,Colombia,,1476401616,100,FALSE,tu,Fri Aug 14 18:42:18 +0000 2015,Bucaramanga,"['estudiante', 'de', 'ingeniería', 'u2665', 'orgullosamente', 'llanera']"
9340,el éxito consiste en confiar en ti no depender de nadie y tener en mente que no hay nada imposible,es,11.6270322,-72.58668457,city,Colombia,,550535784,2991,FALSE,tu,Fri Aug 14 18:46:37 +0000 2015,            colombia,"['estudiante', 'de', 'contaduría', 'publica', 'universidad', 'de', 'la', 'guajira']"
9343,tal parece que mi amor crece y crece mientras tú te desvaneces,es,3.570428504,-76.3486225,city,Colombia,,238716495,353,FALSE,tu,Fri Aug 14 18:48:51 +0000 2015,"Cali, Colombia ","['estudiante', 'de', 'geografía', 'universidad', 'del', 'valle']"
9399,te marchaste y contigo se marcharon mis palabras,es,4.262283503,-74.243671,city,Colombia,,351972503,451,FALSE,tu,Fri Aug 14 19:27:16 +0000 2015,Santa Fe de Bogotá,"['hincha', 'de', 'ind', 'santa', 'fe', 'de', 'la', 'buena', 'época', 'cuando', 'lo', 'importante', 'era', 'el', 'amor', 'al', 'equipo', 'y', 'no', 'títulos', 'estudiante', 'de', 'ingeniería', 'civil']"
9406,cuando estás dejando tus vicios las tentaciones vienen a ti,es,10.90063338,-74.65783138,city,Colombia,,231055013,70,FALSE,tu,Fri Aug 14 19:30:08 +0000 2015,"Barranquilla, Colombia","['estudiante', 'de', 'derechou', '263a']"
9434,y mientras yo me quedo sin ti,es,8.197165001,-73.421408,city,Colombia,,2897728420,43,FALSE,tu,Fri Aug 14 19:49:50 +0000 2015,Ocaña - Colombia,"['intentemoslo', 'estudiante', 'de', 'derecho']"
9550,#noentiendocomo esas personas que no son felices se dedican a joderte la vida para que tú tampoco lo seas,es,4.262283503,-74.243671,city,Colombia,,165875092,156,FALSE,tu,Mon Aug 24 19:19:26 +0000 2015,Bogotá,"['estudiante', 'de', 'medicina', 'otra', 'maniática', 'del', 'anime', 'thats', 'me', 'trying']"
9699,la vida siempre nos ha enseñado a las dos crecimos juntas por eso siempre estaré contigo eres mi hermana mi vida,es,4.448673,-75.3155775,city,Colombia,,1455541939,403,FALSE,tu,Tue Aug 25 22:54:52 +0000 2015,Ibague Tolima,"['estudiante', 'de', 'ingeniería', 'civil']"
9767,en ocasiones tú esperas apoyo pero lo que recibes no es nada de lo esperado y eso duele,es,4.0882915,-73.4704055,city,Colombia,,2200390340,67,FALSE,tu,Tue Aug 25 23:21:59 +0000 2015,Tauramena- Villavicencio ,"['estudiante', 'de', 'medicina', 'veterinaria', 'y', 'zootecnia', 'animalista', 'colombovenezolana']"
9776,y saber que sin ti no soy nada estoy hecha de pedacitos de ti de tu voz andar del reír del caminar,es,6.270882998,-75.619213,city,Colombia,,109705241,222,FALSE,tu,Tue Aug 25 23:28:36 +0000 2015,,"['estudiante', 'de', 'medicina', 'udes', 'como', 'no', 'amarte', 'dios', 'si', 'me', 'sonríes', 'más', 'bonito', 'que', 'la', 'vida']"
9784,quisiera pasar dicha eternidad contigo,es,9.315605496,-75.434214,city,Colombia,,896557171,161,FALSE,tu,Tue Aug 25 23:31:30 +0000 2015,"Sincelejo, Sucre","['estudiante', 'de', 'economía', 'instagram', 'anakarinamaria', '@fcbarcelona']"
9800,amargas mis pocas sonrisas con tu recuerdo pero yo se que alguna se te ha amargado a ti,es,4.262283503,-74.243671,city,Colombia,,194079122,184,FALSE,tu,Tue Aug 25 23:37:02 +0000 2015,,"['estudiante', 'de', 'derecho', 'universidad', 'la', 'gran', 'colombia']"
9803,tantas parejas felices por ahí y yo con este recuerdo permanente de ti,es,4.262283503,-74.243671,city,Colombia,,194079122,184,FALSE,tu,Tue Aug 25 23:37:42 +0000 2015,,"['estudiante', 'de', 'derecho', 'universidad', 'la', 'gran', 'colombia']"
9835,si soy un bicho raro pero sabes que algún día dejaré de serlo pero tú tú nunca dejarás de ser una idiota,es,6.997779996,-73.8367895,city,Colombia,,204450352,388,FALSE,tu,Tue Aug 25 23:52:06 +0000 2015,,"['estudiante', 'de', 'trabajo', 'socialu', '2665']"
9862,todo lo tengo acostumbrado a ti,es,10.95807288,-74.849933,city,Colombia,,253575561,1233,FALSE,tu,Wed Aug 26 00:02:59 +0000 2015,B/quilla,"['peter', 'manjarres', 'y', 'sergio', 'luis', 'rodriguez', 'estudiante', 'de', 'medicina', 'soy', 'orgullosamente', 'de', 'la', 'tierra', 'donde', 'nacen', 'los', 'mejores', 'atardeceres', 'mi', 'guajirau', '2764ufe0f']"
9897,verte hablar tomar un café sabes cómo llenarme de tranquilidad y alegría te amo muchoo u2764ufe0fu2728 detesto pelear contigo @sancamilobad,es,4.262283503,-74.243671,city,Colombia,,448381130,206,FALSE,tu,Wed Aug 26 00:19:27 +0000 2015,"Bogotá, Colombia.","['filosofía', 'de', 'vida', 'altruista', 'y', 'filantrópicau', '2665', 'estudiante', 'de', 'derecho', '27u2661']"
9913,algún día el problema no radicara en ti si no en mi,es,4.262283503,-74.243671,city,Colombia,,208152899,219,FALSE,tu,Wed Aug 26 00:24:19 +0000 2015,Bogotá,"['estudiante', 'de', 'enfermeria', 'superior', 'fucs', 'si', 'hablas', 'en', 'diminutivo', 'sueñas', 'en', 'diminutivo', 'untouched', 'mispapasyaleja', '26forever', 'amolosniñoslosbebeslosontodoenmividau', '2665']"
9951,@pulpoviera te deseo una pronta recuperación dios te bendiga y mucha fuerza a ti y a tu familia un abrazo,es,3.364181997,-76.49608,city,Colombia,277113936,322386648,315,FALSE,tu,Wed Aug 26 00:38:39 +0000 2015,cali-valle,"['defensa', 'central', 'club', 'actual', '@asodeporcali', 'gracias', 'dios', 'por', 'la', 'bendicion', 'de', 'jugar', 'al', 'futbol', 'estudiante', 'de', 'derecho', 'en', '@ucooperativacol']"
9987,@addcamal bebé me acorde de la primera vez que cante una canción pedo contigo creo que fue esta,es,7.144792999,-73.132697,city,Colombia,818548380,128757830,353,FALSE,tu,Wed Aug 26 00:49:58 +0000 2015,Mexico,"['estudiante', 'de', 'ciencias', 'de', 'la', 'comunicación', 'en', 'la', 'unam', 'alegre', 'intenso', 'y', 'apasionado', 'amante', 'de', 'la', 'diversión', 'sigueme', 'y', 'te', 'sigo']"
9993,el peor error que puedes cometer es alejarte de una persona que siempre estuvo ahí para ti,es,11.2312007,-72.994963,city,Colombia,,550535784,3014,FALSE,tu,Wed Aug 26 00:53:21 +0000 2015,            colombia,"['estudiante', 'de', 'contaduría', 'publica', 'universidad', 'de', 'la', 'guajira']"
9996,vive como tú quieres vivir no como los demás quieren que tú vivas porque tú eres el único que marca la diferencia,es,11.2312007,-72.994963,city,Colombia,,550535784,3014,FALSE,tu,Wed Aug 26 00:54:22 +0000 2015,            colombia,"['estudiante', 'de', 'contaduría', 'publica', 'universidad', 'de', 'la', 'guajira']"
10014,pero a ti te gustan,es,4.262283503,-74.243671,city,Colombia,,1599543812,13,FALSE,tu,Wed Aug 26 00:59:23 +0000 2015,Bogotá Colombia,"['estudiante', 'de', 'optometria', 'universidad', 'de', 'la', 'salle', 'tratando', 'de', 'no', 'perder', 'la', 'poca', 'capacidad', 'de', 'asombro', 'soñadorre', 'descubriendo', 'mi', 'mundo']"
10021,tú me criticas y yo ni sabía que existías,es,11.2312007,-72.994963,city,Colombia,,550535784,3014,FALSE,tu,Wed Aug 26 01:01:09 +0000 2015,            colombia,"['estudiante', 'de', 'contaduría', 'publica', 'universidad', 'de', 'la', 'guajira']"
10022,y descubrí mas de mil formas de besar y fue por ti que descubrí lo que es amar lo que es amaaaaaarrrr,es,4.262283503,-74.243671,city,Colombia,,307994886,1134,FALSE,tu,Wed Aug 26 01:01:13 +0000 2015,Bogotá-Castilla ,"['estudiante', 'comunicación', 'social', 'y', 'periodismo', 'universidad', 'centralu', '2661']"
10042,@andresarse96 jajajajajajjaja seguro por que el día que fui vi que estaba súper dedicada a ti nada que ver con la monstruo de wilches,es,7.063666499,-73.0964135,city,Colombia,315214717,194445785,274,FALSE,tu,Wed Aug 26 01:08:10 +0000 2015,"Bucaramanga, Santander","['estudiante', 'contabilidad', 'y', 'finanzas', 'dios']"
10123,quiero enamorarme de todo tu mundo y sobre todo de quien eres tú,es,4.811547,-75.6123815,city,Colombia,,2453847899,170,FALSE,tu,Wed Aug 26 01:29:17 +0000 2015,,"['estudiante', 'de', 'tecnología', 'mecánica', 'ingeniería', 'mecánica', 'u2661', 'colombia']"
10216,contigo en la distancia u2764,es,4.262283503,-74.243671,city,Colombia,,287432158,107,FALSE,tu,Thu Aug 27 00:21:49 +0000 2015,"Bogotá, Colombia ","['estudiante', 'de', 'instrumentación', 'quirúrgica', 'ub']"
10275,jajajajajaja solo estoy esperando que me pase para poder pasar por el lado tuyo ignorante y reírme de ti,es,5.657152002,-72.8906175,city,Colombia,,413342992,242,FALSE,tu,Thu Aug 27 00:46:51 +0000 2015,Boyaca-Colombia,"['estudiante', 'de', 'derecho', 'sdc', 'dancer', 'instagram', 'suadancer', 'i', 'u2665', 'rihanna', 'snapchat', 'miguelguti', '97']"
10278,te quiero por q eres tú te adoro por especial y quiero q seas mi novia mi amante y mi amiga como un regalo de dios así yo te vi llegar,es,10.3244505,-73.463286,city,Colombia,,196839593,318,FALSE,tu,Thu Aug 27 00:48:19 +0000 2015,Colombia!,"['enamorada', 'de', 'dios', 'la', 'vida', 'mi', 'familia', 'y', 'mi', 'carrerau', '2665', 'estudiante', 'de', 'leyes', 'ttg', 'u2665']"
10292,si te alejas de dios todo lo bueno se aleja de ti si te acercas a dios todo lo bueno se acerca a ti,es,6.270882998,-75.619213,city,Colombia,,532557688,369,FALSE,tu,Thu Aug 27 00:53:36 +0000 2015,MEDELLIN ,"['sembrando', 'amor', 'u2764ufe0f', 'estudiante', 'de', 'medicina']"
10333,que mi alma solo pertenece a ti,es,10.95807288,-74.849933,city,Colombia,,113151174,477,FALSE,tu,Thu Aug 27 01:10:03 +0000 2015,Colombia,"['estudiante', 'de', 'lic', 'biologia', 'y', 'quimica', 'quimica', 'y', 'farmacia', 'ingles', 'u260ewpp3016902584']"
10400,si te preguntan di que estoy pensando en ti,es,7.144792999,-73.132697,city,Colombia,,466910789,167,FALSE,tu,Thu Aug 27 01:29:24 +0000 2015,"Bucaramanga, Santander","['estudiante', 'uis', 'i', 'vr']"
10414,mi pedacito de cielo eres tú @alvaro15suarez tiamo iloveyou teamo bebé,es,11.07346239,-73.92732164,city,Colombia,,1096849861,143,FALSE,tu,Thu Aug 27 01:32:49 +0000 2015,Santa Marta//Colombia,"['estudiante', 'de', 'practicas', 'profesionales', 'en', 'psicología', 'de', 'la', 'unimag', 'haz', 'el', 'bien', 'sin', 'mirar', 'a', 'quien', 'dios']"
10429,el mundo más hermoso lo daría por ti,es,4.262283503,-74.243671,city,Colombia,,205031882,498,FALSE,tu,Thu Aug 27 01:36:07 +0000 2015,Bogota- Candelaria ,"['estudiante', 'de', 'enfermeriau', '2605soy', 'más', 'veces', 'campeón', 'u2605mfcu2605']"
10437,no te enamoraste de mi si no de ti cuando estas conmigo,es,4.262283503,-74.243671,city,Colombia,,2399854404,151,FALSE,tu,Thu Aug 27 01:39:58 +0000 2015,Bogotá,"['estudiante', 'de', 'comunicación', 'social', 'periodismo', 'eterno', 'amor', 'por', 'dios', 'mi', 'familia', 'y', 'mi', 'sueño', 'mas', 'grande', 'la', 'radiou', '2665']"
10450,salir a caminar contigo,es,11.07346239,-73.92732164,city,Colombia,,267376221,230,FALSE,tu,Thu Aug 27 01:42:48 +0000 2015,"Santa Marta, Magdalena","['estudiante', 'de', 'medicina', 'instagram', '@hugofuentesblanco']"
10555,gracias a dios tu no puedes verme llorando por ti,es,4.262283503,-74.243671,city,Colombia,,405213937,80,FALSE,tu,Thu Aug 27 02:15:09 +0000 2015,,"['estudiante', 'de', 'enfermeria']"
10560,quiero ser el único que te muerda la boca quiero saber que contigo la vida no va a terminar,es,4.262283503,-74.243671,city,Colombia,,189321280,333,FALSE,tu,Thu Aug 27 02:17:13 +0000 2015,"Bogotá, colombia","['estudiante', 'de', 'ingeniería', 'de', 'petróleos', '28u2764ufe0funiversidad', 'de', 'america']"
10580,felicidad eso es lo que tú me das,es,10.95807288,-74.849933,city,Colombia,,303441540,404,FALSE,tu,Thu Aug 27 02:21:48 +0000 2015,,"['estudiante', 'de', 'comunicación', 'social', 'y', 'periodismo']"
10589,no tengo que decir que estés aquí me gustaría que supieras que voy a enloquecer que voy a vivir sin ti,es,4.262283503,-74.243671,city,Colombia,,222451340,107,FALSE,tu,Thu Aug 27 02:24:49 +0000 2015,Bogotá  D.C  - Colombia ,"['estudiante', 'de', 'arquitectura', 'dibujante', 'urbano', 'periodista', 'en', 'proceso', '@doblearadio', 'fotógrafo', 'en', 'proceso', 'cocinero', 'en', 'proceso', 'lector']"
10591,tú y yo hablando mierda siempre @natalyosorio2,es,10.39044865,-75.5496353,city,Colombia,,970959386,417,FALSE,tu,Thu Aug 27 02:25:28 +0000 2015,Colombia.,"['estudiante', 'de', 'medicina', 'lo', 'que', 'me', 'deseas', 'dios', 'el', 'doble', 'te', 'lo', 'conceda']"
10626,mis días son llenos de felicidad gracias a tiu 2764u2764,es,7.144792999,-73.132697,city,Colombia,,584204744,459,FALSE,tu,Thu Aug 27 02:37:22 +0000 2015,,"['diosu', '2764', 'estudiante', 'de', 'ingeniería', 'ambiental', 'uts', 'bucaramangaaguachica']"
10627,no te diré razones para quedarte solo quiero que sepas que aquí se te quiere hasta cuando tú te odias,es,4.656953498,-74.2470895,city,Colombia,,713778600,114,FALSE,tu,Thu Aug 27 02:37:33 +0000 2015,,"['saloméu', '2665', 'si', 'van', 'a', 'poner', 'indirectas', 'para', 'mi', 'le', 'pueden', 'poner', 'mi', 'nombre', 'chiquito', 'abajo', 'es', 'que', 'nunca', 'cojo', 'nada', 'gracias', 'estudiante', 'de', 'hoteleria']"
10664,oye te ves diferente te hiciste algo no nada o que me ves tú no sé ah sí estás más puta que de costumbre,es,4.262283503,-74.243671,city,Colombia,,2244988506,361,FALSE,tu,Thu Aug 27 02:48:04 +0000 2015,Bogotá - Colombia,"['aficionado', 'a', 'los', 'cómics', 'y', 'fanático', 'del', 'fútbol', 'y', 'de', 'megadeth', 'arsenal', 'real', 'madrid', 'estudiante', 'de', 'negocios', 'internacionales', 'siga', 'sin', 'ser', 'invitado']"
10670,y como dijo mi mamá no te quejes que tú sabes que tú vida consiste en leer #semanadeparciales #semanadeentregas #muerodesueño,es,4.262283503,-74.243671,city,Colombia,,434319672,208,FALSE,tu,Thu Aug 27 02:49:17 +0000 2015,,"['estudiante', 'de', 'comunicación', 'social', 'y', 'periodismo', 'estudiante', 'de', 'derecho', 'activista', 'provida', 'amor', 'y', 'respeto', 'por', 'los', 'animales', 'amor', 'infinito', 'por', 'dios']"
10677,quizá no hay palabras pa decir lo que siento por ti lo que me gusta de ti lo que me enamora de ti,es,4.262283503,-74.243671,city,Colombia,,167259410,7551,FALSE,tu,Thu Aug 27 02:50:49 +0000 2015,Bogotá,"['i', 'u2665', 'new', 'york', 'estudiante', 'de', 'gastronomía', 'en', 'gato', 'dumas']"
10739,hablar 5 minutos contigo produce en mi sorisitas 24 horas,es,2.988736497,-75.3222715,city,Colombia,,185729331,242,FALSE,tu,Thu Aug 27 03:13:20 +0000 2015,Neiva ,"['estudiante', 'de', 'ingeniería', 'industrial', 'de', 'la', 'universidad', 'antonio', 'nariño', 'visça', 'barçau', '2665']"
10748,hay tengo un corazón que ya no me cave aquí en el pecho por ti,es,8.887073999,-75.8669775,city,Colombia,,303932125,422,FALSE,tu,Thu Aug 27 03:15:54 +0000 2015,Colombia,"['estudiante', 'de', 'derecho', 'hacer', 'ejercicio', 'me', 'hace', 'feliz', 'dios', 'te', 'amo']"
10757,desde mi primer latido habría ido contigo,es,7.063666499,-73.0964135,city,Colombia,,1385205661,410,FALSE,tu,Thu Aug 27 03:19:37 +0000 2015,Bucaramanga/Santander,"['estudiante', 'de', 'comunicación', 'social']"
10782,@jsefernandezv yo a ti lindo u2764,es,4.909635999,-74.0487635,city,Colombia,375411437,195473438,566,FALSE,tu,Thu Aug 27 03:27:28 +0000 2015,colombia,"['estudiante', 'de', 'antropología', 'en', 'la', 'universidad', 'javeriana', 'amante', 'del', 'futbol', 'y', 'de', 'santa', 'fe']"
10784,todo mi cariño que sea pronto también para ti hermosa,es,4.812912999,-75.737506,city,Colombia,,573251436,998,FALSE,tu,Thu Aug 27 03:27:39 +0000 2015,Uruguay - Colombia ,"['estudiante', 'de', 'arquitectura', 'instagram', 'jesicaheredia', '16', 'facebook', 'jesica', 'heredia', 'snap', 'jesshe', '16']"
10785,hay algo que me gusta de ti,es,5.490470499,-73.38497,city,Colombia,,156427113,295,FALSE,tu,Thu Aug 27 03:29:20 +0000 2015,Colombia,"['estudiante', 'psicología', 'u2764', 'se', 'vale', 'soñar', 'u2764', 'snapchat', 'u27a1', 'mafesuu']"
10800,todos mis sueños están puestos en ti mi dios lt3,es,4.262283503,-74.243671,city,Colombia,,2812586578,278,FALSE,tu,Thu Aug 27 03:33:43 +0000 2015,Bogota D.C,"['hija', 'de', 'dios', 'estudiante', 'de', 'contaduría', 'pública', 'instagram', '@loregmurcia', 'colombiana', 'mci', 'dios', 'mi', 'vida', 'entera', 'millonarios', '\\']"
10801,algo contigo,es,2.120269,-75.572157,city,Colombia,,394930413,687,FALSE,tu,Thu Aug 27 03:33:56 +0000 2015,Colombia,"['estudiante', 'ingeniería', 'agrícola']"
10806,yo tengo fe en ti señor se que tienes grandes planes para mi,es,4.909635999,-74.0487635,city,Colombia,,426745584,585,FALSE,tu,Thu Aug 27 03:35:17 +0000 2015,,"['estudiante', 'de', 'psicología', 'u03a8almamente', 'y', 'corazon', 'millonarios', 'fc', 'voleibol', 'don', 'tetto']"
10814,ojalá te des cuenta que a ti te miro diferente,es,5.490470499,-73.38497,city,Colombia,,528801163,250,FALSE,tu,Thu Aug 27 03:37:21 +0000 2015,colombia - tunja,"['amor', 'mi', 'vida', 'siempre', 'junto', 'a', 'ti', 'adag', 'estudiante', 'de', 'arquitectura', 'universidad', 'santo', 'tomás']"
10815,que bello es reír con gente como tú bella jajajajajajaajaj,es,4.448673,-75.3155775,city,Colombia,,328241852,489,FALSE,tu,Thu Aug 27 03:37:39 +0000 2015,Ibague,"['estudiante', 'de', 'derecho', 'ut', 'all', 'this', 'is', 'vodka', 'in', 'tea', 'cups']"
10845,por cosas como las que haces es por las que me aferro a ti gracias por esperarme siempre ilyu 2665 @maikk94,es,4.262283503,-74.243671,city,Colombia,,229311538,514,FALSE,tu,Thu Aug 27 03:44:32 +0000 2015,Bogotá,"['diseñadora', 'gráfica', 'u2605', 'estudiante', 'de', 'fotografía', 'pasiones', 'sueños', 'e', 'ilusionesu', '2665', 'hincha', 'de', 'millonarios', 'fcu', '2665']"
10857,amore el mejor cumpleaños para ti en la neverau 2744 yese 2608 @ hooters 116,es,4.262283503,-74.243671,city,Colombia,,230282726,304,FALSE,tu,Thu Aug 27 03:47:33 +0000 2015,Bogota/Cartagena/Miami,"['estudiante', 'relaciones', 'internacionales', 'y', 'estudios', 'politicos', 'umng', 'entrelazando', 'continentes', 'otro', 'testimonio', 'de', 'vida']"
10864,entre tú y yo no hay razones sólo sentimientos,es,5.878607,-73.0912995,city,Colombia,,608669470,1354,FALSE,tu,Thu Aug 27 03:49:16 +0000 2015,,"['estudiante', 'de', 'fisioterapia', 'universidad', 'de', 'boyacá', 'kathe', 'obregon', 'u2764tpmmju2764']"
10908,gracias a dios por haber cambiado mi suerte gracias a ti mi amor por llenarme la vida,es,10.95807288,-74.849933,city,Colombia,,253575561,1235,FALSE,tu,Thu Aug 27 03:59:44 +0000 2015,B/quilla,"['peter', 'manjarres', 'y', 'sergio', 'luis', 'rodriguez', 'estudiante', 'de', 'medicina', 'soy', 'orgullosamente', 'de', 'la', 'tierra', 'donde', 'nacen', 'los', 'mejores', 'atardeceres', 'mi', 'guajirau', '2764ufe0f']"
10925,poder decir que soy feliz lejos de ti,es,4.262283503,-74.243671,city,Colombia,,351068157,1784,FALSE,tu,Thu Aug 27 04:07:16 +0000 2015,Bogota,"['estudiante', 'de', 'diseño', 'industrialuel', 'bosque', 'amante', 'de', 'la', 'música', 'y', 'el', 'arte', 'canta', 'autor', '19', 'años', 'yorjan', '96', '@gmailcom', '8be', 'happy', 'be', 'free', 'be', 'you', '8']"
10938,y si preguntas si la puya es para ti obvio que si,es,11.07346239,-73.92732164,city,Colombia,,144290759,1724,FALSE,tu,Thu Aug 27 04:12:01 +0000 2015,"Santa marta,Colombia.","['actriz', 'y', 'modelo', 'estudiante', 'de', 'negocios', 'internacionales', 'colombian', 'flavor', 'instagramfb', 'snapchatyoutubegreissbaquero']"
10940,mas fuerte que nunca gracias a ti mi dios lt3,es,4.262283503,-74.243671,city,Colombia,,2812586578,279,FALSE,tu,Thu Aug 27 04:12:06 +0000 2015,Bogota D.C,"['hija', 'de', 'dios', 'estudiante', 'de', 'contaduría', 'pública', 'instagram', '@loregmurcia', 'colombiana', 'mci', 'dios', 'mi', 'vida', 'entera', 'millonarios', '\\']"
10993,lo que más me gusta se ti es tu inteligencia papasoteu 2665,es,4.262283503,-74.243671,city,Colombia,,156071300,168,FALSE,tu,Thu Aug 27 04:30:55 +0000 2015,Bogotá Colombia,"['estudiante', 'de', 'contaduría', 'pública', 'y', 'administración', 'de', 'empresas', 'universidad', 'de', 'la', 'salle']"
11011,#simiperrohablara fijo seria así ya mami estaré contigo toda la vida mataremos a mordidas a ese infeliz,es,4.262283503,-74.243671,city,Colombia,,607453349,674,FALSE,tu,Thu Aug 27 04:36:51 +0000 2015,"Bogotá, Colombia","['estudiante', 'de', 'ingenieria', 'industrial', 'universidad', 'central', 'enamorada', 'de', 'la', 'vida', 'de', 'mi', 'familia', 'de', 'mi', 'y', 'de', 'mi', 'carrera', 'u2665']"
11021,se todo de ti hasta el tamaño de tus pequeñas pestañas,es,4.262283503,-74.243671,city,Colombia,,562557465,478,FALSE,tu,Thu Aug 27 04:41:06 +0000 2015,"Santa Marta, Magdalena","['estudiante', 'de', 'cine', 'y', 'audiovisuales']"
11032,me niego a estar sin ti,es,2.120269,-75.572157,city,Colombia,,394930413,687,FALSE,tu,Thu Aug 27 04:44:50 +0000 2015,Colombia,"['estudiante', 'ingeniería', 'agrícola']"
11046,por si me lees sigo trasnochando pensando en ti y anhelando un mensaje tuyo,es,4.262283503,-74.243671,city,Colombia,,607453349,674,FALSE,tu,Thu Aug 27 04:49:30 +0000 2015,"Bogotá, Colombia","['estudiante', 'de', 'ingenieria', 'industrial', 'universidad', 'central', 'enamorada', 'de', 'la', 'vida', 'de', 'mi', 'familia', 'de', 'mi', 'y', 'de', 'mi', 'carrera', 'u2665']"
11050,tú tampoco duermes hoy,es,4.262283503,-74.243671,city,Colombia,,363377283,476,FALSE,tu,Thu Aug 27 04:51:03 +0000 2015,Bogotá.Colombia,"['instagram', 'majogomezp', 'vicente', 'garcía', 'estudiante', 'de', 'ingeniería', 'ambiental']"
11065,yo fui quien estuvo contigo cuando tu mas lo necesitabas yo fui quien dio la cara por tu amor sin importarme tus problemas,es,10.95807288,-74.849933,city,Colombia,,2209881162,417,FALSE,tu,Thu Aug 27 05:02:28 +0000 2015,"Barranquilla, Atlántico","['estudiante', 'de', 'comunicación', 'social', 'y', 'periodismo', 'uniautonomau', '2764', 'riohachera']"
11079,@dannivelezdonad @carocuartas gracias a nosotras tú vida es más feliz,es,6.270882998,-75.619213,city,Colombia,241649594,624241674,56,FALSE,tu,Thu Aug 27 05:09:12 +0000 2015,Medellin,"['estudiante', 'de', 'derecho', 'universidad', 'de', 'medellin', 'instagram', 'anabarrera', '17']"
11096,entiende no se amar pero contigo quiero aprender,es,4.262283503,-74.243671,city,Colombia,,270056370,90,FALSE,tu,Thu Aug 27 05:18:14 +0000 2015,colombia,"['estudiante', 'lic', 'matemáticas', 'upedagogica', 'un', 'solo', 'sentimiento', 'independiente', 'santa', 'fe', 'godu', '2661']"
11099,despedirnos y darme cuenta que solo me conecto para hablar contigo,es,4.262283503,-74.243671,city,Colombia,,200714269,408,FALSE,tu,Thu Aug 27 05:19:43 +0000 2015,,"['rivera', 'angie', 'estudiante', 'de', 'diseño', 'gráfico', 'tadeista', 'fotografíaaaaaaaaaaaaaaaaau', '2764']"
11101,#value,es,4.262283503,-74.243671,city,Colombia,,200714269,408,FALSE,tu,Thu Aug 27 05:21:09 +0000 2015,,"['rivera', 'angie', 'estudiante', 'de', 'diseño', 'gráfico', 'tadeista', 'fotografíaaaaaaaaaaaaaaaaau', '2764']"
